{
  "$schema": "http://json-schema.org/draft-07/schema#",
  "title": "RoleConfig",
  "description": "Configuration for a KĀDI worker agent role. Defines capabilities, infrastructure, and behavior for a specific agent role.",
  "type": "object",
  "required": ["role", "capabilities", "maxConcurrentTasks", "worktreePath", "eventTopic", "commitFormat"],
  "properties": {
    "role": {
      "type": "string",
      "enum": ["artist", "programmer", "designer"],
      "description": "Agent role identifier"
    },
    "capabilities": {
      "type": "array",
      "items": { "type": "string" },
      "minItems": 1,
      "description": "Capability keywords for task matching. Incoming tasks are validated against these."
    },
    "maxConcurrentTasks": {
      "type": "integer",
      "minimum": 1,
      "maximum": 10,
      "description": "Maximum number of tasks this agent can execute concurrently"
    },
    "worktreePath": {
      "type": "string",
      "minLength": 1,
      "description": "Absolute path to the git worktree where this agent creates output"
    },
    "eventTopic": {
      "type": "string",
      "minLength": 1,
      "description": "Base KĀDI event topic prefix (e.g., 'task' for task.assigned, task.completed)"
    },
    "commitFormat": {
      "type": "string",
      "minLength": 1,
      "description": "Git commit message template. Use {taskId} as placeholder."
    },
    "provider": {
      "type": "object",
      "description": "LLM provider configuration (optional — agent works without it but cannot execute LLM tasks)",
      "properties": {
        "model": {
          "type": "string",
          "minLength": 1,
          "description": "Claude model identifier (e.g., 'claude-sonnet-4-5-20250929')"
        },
        "temperature": {
          "type": "number",
          "minimum": 0,
          "maximum": 2,
          "description": "Sampling temperature for LLM responses"
        },
        "maxTokens": {
          "type": "integer",
          "minimum": 1,
          "maximum": 65536,
          "description": "Maximum output tokens per LLM call"
        }
      },
      "required": ["model"]
    },
    "memory": {
      "type": "object",
      "description": "Memory service configuration (optional — agent works without persistent memory)",
      "properties": {
        "enabled": {
          "type": "boolean",
          "description": "Whether memory service is active for this role"
        },
        "namespace": {
          "type": "string",
          "pattern": "^[a-z][a-z0-9-]*$",
          "description": "Memory namespace for isolating this role's data (lowercase, alphanumeric + hyphens)"
        }
      },
      "required": ["enabled", "namespace"]
    },
    "tools": {
      "type": "array",
      "items": { "type": "string" },
      "description": "List of MCP tool prefixes this role can invoke (e.g., 'git_git_', 'ability_file_')"
    }
  },
  "additionalProperties": false
}
